{
   "wsagger": "0.0.2",
   "info": {
      "description": "API for GBK chat",
      "version": "1.0.0",
      "title": "GBKSOFT chat API"
   },

   "server" : {
      "proto": "socket.io",
      "host" : "localhost",
      "port" : "28780",
      "path" : "/front_space"
   },
   
   "scenarios": [
       {
          "name": "connect to socket.io as token2",
          "summary": " ",
          "parameters": [
             {             
                "in": "formData",
                "name": "namespace",
                "description": "connect to socket.io",
                "dataType": "string"
             }
          ],
          "operationId": "connect",
          "flow": [
             {
                "action": "connect", 
                "key": "2", 
                "data": [{"token": "2"}]
             }
          ]
       },

       {
          "name": "connect to socket.io as alexr",
          "summary": " ",
          "parameters": [
          ],
          "operationId": "connect",
          "flow": [
             {
                "action": "login_and_connect", 
                "key": "alexr", 
                "data": [{"username": "alexr", "password": "alexr"}]
             }
          ]
       },


       {
          "name": "sendUserMessage to token2",
          "summary": " ",
          "parameters": [
          ],
          "operationId": "",
          "condition": "connect",
          "flow": [
             {
                "action": "request", 
                "key": "sendMessage", 
                "data": [{"messageText": "text: {{messageText}}", "type": "user", "recipientId": "token2"}]
             }
          ]
       }
    ]
}

